{
  "schema": "codegg.project-summary.v2",
  "source_revision": "abc123",
  "events": [
    {
      "id": "actor-1",
      "occurred_at": "2026-10-19T10:00:00Z",
      "kind": "file_changed",
      "path": "src/lib.rs",
      "insertions": 2,
      "deletions": 1,
      "actor": "Alice_1"
    }
  ],
  "totals": {
    "events": 1,
    "files_changed": 1,
    "insertions": 2,
    "deletions": 1
  },
  "by_kind": {
    "file_changed": 1,
    "test_passed": 0,
    "test_failed": 0
  }
}
